{
  "$schema": "http://json-schema.org/draft-07/schema#",
  "title": "n8n Workflow",
  "type": "object",
  "required": ["name", "nodes", "connections", "settings", "tag"],
  "properties": {
    "name": { "type": "string", "minLength": 3 },
    "tag": { "type": "string" },
    "nodes": {
      "type": "array",
      "minItems": 1,
      "items": {
        "type": "object",
        "required": ["id", "name", "type", "typeVersion", "position", "parameters"],
        "properties": {
          "id": { "type": "string" },
          "name": { "type": "string" },
          "type": { "type": "string" },
          "typeVersion": { "type": "number" },
          "position": {
            "type": "array",
            "items": { "type": "number" },
            "minItems": 2,
            "maxItems": 2
          },
          "parameters": { "type": "object" }
        }
      }
    },
    "connections": { "type": "object" },
    "settings": { "type": "object" }
  }
}
