{
  "name": "Daily Tasks Digest",
  "tag": "Tasks",
  "nodes": [
    {
      "id": "30",
      "name": "Cron",
      "type": "n8n-nodes-base.cron",
      "typeVersion": 1,
      "position": [0, 0],
      "parameters": {
        "triggerTimes": [
          {
            "hour": 9,
            "minute": 15
          }
        ]
      }
    },
    {
      "id": "31",
      "name": "Linear - List Issues",
      "type": "n8n-nodes-base.httpRequest",
      "typeVersion": 2,
      "position": [300, 0],
      "parameters": {
        "url": "https://api.linear.app/graphql",
        "method": "POST",
        "jsonParameters": true,
        "headers": {
          "Authorization": "Bearer {{ $env.LINEAR_TOKEN }}"
        },
        "body": {
          "query": "query { issues(filter: {state: {name: {eq: \"In Progress\"}}}) { nodes { identifier title assignee { name } } } }"
        }
      }
    },
    {
      "id": "32",
      "name": "Slack Digest",
      "type": "n8n-nodes-base.slack",
      "typeVersion": 1,
      "position": [600, 0],
      "parameters": {
        "operation": "post",
        "channel": "#ops-daily",
        "text": "Daily task digest generated by Tasks Agent"
      }
    }
  ],
  "connections": {
    "Cron": {
      "main": [
        [
          {
            "node": "Linear - List Issues",
            "type": "main",
            "index": 0
          }
        ]
      ]
    },
    "Linear - List Issues": {
      "main": [
        [
          {
            "node": "Slack Digest",
            "type": "main",
            "index": 0
          }
        ]
      ]
    }
  },
  "settings": {
    "executionTimeout": 300,
    "timezone": "UTC"
  }
}
